[
  {
    "featureId": "ai.generative",
    "domain": "collaboration-cloud-ai",
    "title": "Generative functions",
    "status": "ENTITLEMENT_BLOCKED",
    "backends": [
      "service",
      "ui"
    ],
    "risk": "R3",
    "minimumPremiereVersion": "26.3.0",
    "maximumPremiereVersion": null,
    "preconditions": [
      "authenticated account",
      "required entitlement",
      "explicit service authorization",
      "eligible media and region"
    ],
    "verification": [
      "service receipt",
      "host-visible state readback"
    ],
    "fixture": null,
    "limitations": [
      "No live v0.3 evidence has been recorded for this feature family."
    ]
  },
  {
    "featureId": "ame.queue_status",
    "domain": "export-ame-interchange",
    "title": "Adobe Media Encoder queue and status",
    "status": "UNVERIFIED",
    "backends": [
      "cep",
      "ui"
    ],
    "risk": "R2",
    "minimumPremiereVersion": "26.3.0",
    "maximumPremiereVersion": null,
    "preconditions": [
      "compatible Adobe Media Encoder installation",
      "active disposable sequence",
      "matching scoped state token"
    ],
    "verification": [
      "queue item identity and terminal status readback"
    ],
    "fixture": null,
    "limitations": [
      "No live v0.3 evidence has been recorded for this feature family."
    ]
  },
  {
    "featureId": "audio.channel_mapping",
    "domain": "audio",
    "title": "Audio channel mapping",
    "status": "UNVERIFIED",
    "backends": [
      "uxp",
      "cep",
      "ui"
    ],
    "risk": "R2",
    "minimumPremiereVersion": "26.3.0",
    "maximumPremiereVersion": null,
    "preconditions": [
      "active disposable project",
      "matching scoped state token"
    ],
    "verification": [
      "channel mapping readback"
    ],
    "fixture": "audio-multichannel",
    "limitations": [
      "No live v0.3 evidence has been recorded for this feature family."
    ]
  },
  {
    "featureId": "audio.clip_gain",
    "domain": "audio",
    "title": "Clip gain",
    "status": "UNVERIFIED",
    "backends": [
      "uxp",
      "cep"
    ],
    "risk": "R1",
    "minimumPremiereVersion": "26.3.0",
    "maximumPremiereVersion": null,
    "preconditions": [
      "active disposable sequence",
      "matching scoped state token"
    ],
    "verification": [
      "clip gain readback"
    ],
    "fixture": "audio-multichannel",
    "limitations": [
      "No live v0.3 evidence has been recorded for this feature family."
    ]
  },
  {
    "featureId": "audio.enhance_speech",
    "domain": "audio",
    "title": "Enhance Speech",
    "status": "EXTERNAL_SERVICE_REQUIRED",
    "backends": [
      "service",
      "ui"
    ],
    "risk": "R3",
    "minimumPremiereVersion": "26.3.0",
    "maximumPremiereVersion": null,
    "preconditions": [
      "authenticated account",
      "required entitlement",
      "explicit service authorization"
    ],
    "verification": [
      "service receipt",
      "enhanced clip state readback"
    ],
    "fixture": null,
    "limitations": [
      "No live v0.3 evidence has been recorded for this feature family."
    ]
  },
  {
    "featureId": "audio.essential_sound",
    "domain": "audio",
    "title": "Essential Sound",
    "status": "UI_ADAPTER_REQUIRED",
    "backends": [
      "ui"
    ],
    "risk": "R2",
    "minimumPremiereVersion": "26.3.0",
    "maximumPremiereVersion": null,
    "preconditions": [
      "registered UI fingerprint",
      "active disposable sequence",
      "matching scoped state token"
    ],
    "verification": [
      "audio type and applied settings readback"
    ],
    "fixture": null,
    "limitations": [
      "No live v0.3 evidence has been recorded for this feature family."
    ]
  },
  {
    "featureId": "audio.keyframes",
    "domain": "audio",
    "title": "Audio keyframes",
    "status": "UNVERIFIED",
    "backends": [
      "uxp",
      "cep"
    ],
    "risk": "R2",
    "minimumPremiereVersion": "26.3.0",
    "maximumPremiereVersion": null,
    "preconditions": [
      "active disposable sequence",
      "matching scoped state token"
    ],
    "verification": [
      "audio keyframe collection readback"
    ],
    "fixture": null,
    "limitations": [
      "No live v0.3 evidence has been recorded for this feature family."
    ]
  },
  {
    "featureId": "audio.loudness",
    "domain": "audio",
    "title": "Loudness measurement and normalization",
    "status": "UI_ADAPTER_REQUIRED",
    "backends": [
      "ui"
    ],
    "risk": "R2",
    "minimumPremiereVersion": "26.3.0",
    "maximumPremiereVersion": null,
    "preconditions": [
      "registered UI fingerprint",
      "active disposable sequence",
      "matching scoped state token"
    ],
    "verification": [
      "measured loudness and applied gain readback"
    ],
    "fixture": null,
    "limitations": [
      "No live v0.3 evidence has been recorded for this feature family."
    ]
  },
  {
    "featureId": "audio.remix",
    "domain": "audio",
    "title": "Remix",
    "status": "UI_ADAPTER_REQUIRED",
    "backends": [
      "ui"
    ],
    "risk": "R2",
    "minimumPremiereVersion": "26.3.0",
    "maximumPremiereVersion": null,
    "preconditions": [
      "registered UI fingerprint",
      "active disposable sequence",
      "matching scoped state token"
    ],
    "verification": [
      "remixed duration and clip state readback"
    ],
    "fixture": null,
    "limitations": [
      "No live v0.3 evidence has been recorded for this feature family."
    ]
  },
  {
    "featureId": "audio.submix_send",
    "domain": "audio",
    "title": "Submixes and sends",
    "status": "UI_ADAPTER_REQUIRED",
    "backends": [
      "ui"
    ],
    "risk": "R2",
    "minimumPremiereVersion": "26.3.0",
    "maximumPremiereVersion": null,
    "preconditions": [
      "registered UI fingerprint",
      "active disposable sequence",
      "matching scoped state token"
    ],
    "verification": [
      "routing graph readback"
    ],
    "fixture": null,
    "limitations": [
      "No live v0.3 evidence has been recorded for this feature family."
    ]
  },
  {
    "featureId": "audio.track_mixer",
    "domain": "audio",
    "title": "Audio track mixer",
    "status": "UI_ADAPTER_REQUIRED",
    "backends": [
      "ui"
    ],
    "risk": "R2",
    "minimumPremiereVersion": "26.3.0",
    "maximumPremiereVersion": null,
    "preconditions": [
      "registered UI fingerprint",
      "active disposable sequence",
      "matching scoped state token"
    ],
    "verification": [
      "mixer control and automation-mode readback"
    ],
    "fixture": null,
    "limitations": [
      "No live v0.3 evidence has been recorded for this feature family."
    ]
  },
  {
    "featureId": "audio.volume_pan",
    "domain": "audio",
    "title": "Volume and pan",
    "status": "UNVERIFIED",
    "backends": [
      "uxp",
      "cep"
    ],
    "risk": "R1",
    "minimumPremiereVersion": "26.3.0",
    "maximumPremiereVersion": null,
    "preconditions": [
      "active disposable sequence",
      "matching scoped state token"
    ],
    "verification": [
      "volume and pan readback"
    ],
    "fixture": null,
    "limitations": [
      "No live v0.3 evidence has been recorded for this feature family."
    ]
  },
  {
    "featureId": "captions.import_export",
    "domain": "text-transcript-captions-graphics",
    "title": "Caption import and export",
    "status": "UNVERIFIED",
    "backends": [
      "uxp",
      "cep",
      "ui"
    ],
    "risk": "R2",
    "minimumPremiereVersion": "26.3.0",
    "maximumPremiereVersion": null,
    "preconditions": [
      "active disposable sequence",
      "matching scoped state token",
      "approved caption path"
    ],
    "verification": [
      "caption cue readback or stable exported file"
    ],
    "fixture": null,
    "limitations": [
      "No live v0.3 evidence has been recorded for this feature family."
    ]
  },
  {
    "featureId": "captions.inspect",
    "domain": "public-text_captions",
    "title": "Inspect captions",
    "status": "SUPPORTED_CONTEXTUAL",
    "backends": [
      "uxp",
      "cep"
    ],
    "risk": "R0",
    "minimumPremiereVersion": "26.3.0",
    "maximumPremiereVersion": null,
    "preconditions": [
      "connected host session"
    ],
    "verification": [
      "host snapshot"
    ],
    "fixture": null,
    "limitations": [
      "Public action is registered from the catalog; live v0.3 evidence has not been recorded."
    ]
  },
  {
    "featureId": "captions.track_cue.crud",
    "domain": "text-transcript-captions-graphics",
    "title": "Caption track and cue CRUD",
    "status": "UNVERIFIED",
    "backends": [
      "uxp",
      "cep",
      "ui"
    ],
    "risk": "R2",
    "minimumPremiereVersion": "26.3.0",
    "maximumPremiereVersion": null,
    "preconditions": [
      "active disposable sequence",
      "matching scoped state token"
    ],
    "verification": [
      "caption track and cue collection readback"
    ],
    "fixture": "captions-transcript",
    "limitations": [
      "No live v0.3 evidence has been recorded for this feature family."
    ]
  },
  {
    "featureId": "cep.destructive",
    "domain": "public-api",
    "title": "Invoke legacy DOM destructive capability",
    "status": "PREVIEW_ONLY",
    "backends": [
      "cep"
    ],
    "risk": "R3",
    "minimumPremiereVersion": "26.3.0",
    "maximumPremiereVersion": null,
    "preconditions": [
      "connected host session"
    ],
    "verification": [
      "opaque capability and host response"
    ],
    "fixture": null,
    "limitations": [
      "Public action is registered from the catalog; live v0.3 evidence has not been recorded."
    ]
  },
  {
    "featureId": "cep.edit",
    "domain": "public-api",
    "title": "Invoke legacy DOM edit capability",
    "status": "SUPPORTED_CONTEXTUAL",
    "backends": [
      "cep"
    ],
    "risk": "R1",
    "minimumPremiereVersion": "26.3.0",